{
  "format_version": 1,
  "kind": "preflop",
  "source": "reference",
  "id": "a3c9e1f2-7b4d-4e6f-9a0b-2c3d4e5f6a7b",
  "engine_version": "reference-2026-10",
  "config": {
    "format": "live",
    "table_size": 9,
    "stake": "1/3",
    "depth_cbb": 15000,
    "straddle": false,
    "ante_cbb": 0
  },
  "config_id": "cfg_9_live_13_150",
  "chunks": [
    {
      "path": "chunks/0000.bin.zst",
      "sha256": "4e07408562bedb8b60ce05c1decfe3ad16b72230967de01f640b7e4729b49fce",
      "node_count": 1831
    },
    {
      "path": "chunks/0001.bin.zst",
      "sha256": "ef2d127de37b942baad06145e54b0c619a1f22327b2ebbcfbec78f5564afe39d",
      "node_count": 942
    }
  ],
  "tree_hash": "7d2e4f6a8b0c9d1e3f5a7b9c0d2e4f6aa6f4e2d0c9b7a5f3e1d9c0b8a6f4e2d7",
  "seed": 7,
  "iterations": 500000,
  "exploitability_pct_pot": [0.12, 0.09],
  "synthetic": false,
  "created_at": "2026-10-20T12:00:00Z"
}
