{
  "format_version": 1,
  "kind": "flop_build",
  "source": "own",
  "id": "6f1d2c3a-4b5e-4f70-8a9b-0c1d2e3f4a5b",
  "engine_version": "0.1.0",
  "config": {
    "format": "online",
    "table_size": 6,
    "stake": "0.5/1",
    "depth_cbb": 10000,
    "straddle": false,
    "ante_cbb": 0
  },
  "config_id": "cfg_6_online_100",
  "pair": "BB-BTN",
  "flop": "Ah7d2c",
  "flop_weight": 12,
  "lines": [
    {
      "line": "r250.c",
      "tree_hash": "3b9f0a7c2d1e4f6a8b0c9d2e4f6a8b0cc0b8a6f4e2d9c0b8a6f4e1d2c7a0f9b3",
      "seed": 42,
      "iterations": 2000,
      "exploitability_pct_pot": [0.31, 0.28],
      "flop_file": "flop/r250.c.bin.zst",
      "sha256": "9c1185a5c5e9fc54612808977ee8f548b2258d31f9be2d0c1b5a6d2c3e4f5a6b"
    }
  ],
  "runouts": [
    {
      "turn": "Kh",
      "river": "9s",
      "files": {
        "r250.c": {
          "path": "runouts/Kh9s/r250.c.bin.zst",
          "sha256": "0b7e2c9d4f6a8b1c3d5e7f9a0b2c4d6e8f0a1b3c5d7e9f1a2b4c6d8e0f1a2b3c"
        }
      }
    }
  ],
  "turn_roots": [],
  "synthetic": true,
  "created_at": "2026-10-20T12:00:00Z"
}
